<!DOCTYPE ficAlimMENESR SYSTEM "ficAlimMENESR.dtd">
<ficAlimMENESR>
<!-- versionAF="AAF-VE1301" -->
<addRequest>
<operationalAttributes><attr name="categoriePersonne"><value>PersRelEleve</value></attr></operationalAttributes>
<identifier><id>2033187</id></identifier>
<attributes>
<attr name="ENTPersonJointure"><value>2033187</value></attr>
<attr name="ENTPersonDateNaissance"><value/></attr>
<attr name="ENTPersonNomPatro"><value>SIOQ</value></attr>
<attr name="sn"><value>Thompson</value></attr>
<attr name="givenName"><value>Sélène</value></attr>
<attr name="personalTitle"><value>M.</value></attr>
<attr name="homePhone"><value>0000000000</value></attr>
<attr name="telephoneNumber"><value>0000000000</value></attr>
<attr name="ENTPersonAdresse"><value>XXXXXXXXXX XXXXXXXXXX XXXXXXXXXX XXXXXXXXXX</value></attr>
<attr name="ENTPersonCodePostal"><value>13110</value></attr>
<attr name="ENTPersonVille"><value>PORT DE BOUC</value></attr>
<attr name="ENTPersonPays"><value>FRANCE</value></attr>
</attributes>
</addRequest>
</ficAlimMENESR>
