<!DOCTYPE ficAlimMENESR SYSTEM "ficAlimMENESR.dtd">
<ficAlimMENESR>
<!-- versionAF="AAF-VE1301" -->
<addRequest>
<operationalAttributes><attr name="categoriePersonne"><value>PersRelEleve</value></attr></operationalAttributes>
<identifier><id>2004775</id></identifier>
<attributes>
<attr name="ENTPersonJointure"><value>2004775</value></attr>
<attr name="ENTPersonDateNaissance"><value/></attr>
<attr name="ENTPersonNomPatro"><value>SAKSOL</value></attr>
<attr name="sn"><value>Frazier</value></attr>
<attr name="givenName"><value>Tú</value></attr>
<attr name="personalTitle"><value/></attr>
<attr name="homePhone"><value>0000000000</value></attr>
<attr name="telephoneNumber"><value>0000000000</value></attr>
<attr name="ENTPersonAdresse"><value>XXXXXXXXXX XXXXXXXXXX XXXXXXXXXX XXXXXXXXXX</value></attr>
<attr name="ENTPersonCodePostal"><value>13510</value></attr>
<attr name="ENTPersonVille"><value>EGUILLES</value></attr>
<attr name="ENTPersonPays"><value>FRANCE</value></attr>
</attributes>
</addRequest>
<addRequest>
<operationalAttributes><attr name="categoriePersonne"><value>PersRelEleve</value></attr></operationalAttributes>
<identifier><id>2004882</id></identifier>
<attributes>
<attr name="ENTPersonJointure"><value>2004882</value></attr>
<attr name="ENTPersonDateNaissance"><value/></attr>
<attr name="ENTPersonNomPatro"><value>GOLVE</value></attr>
<attr name="sn"><value>Ray</value></attr>
<attr name="givenName"><value>Léonore</value></attr>
<attr name="personalTitle"><value>Mme</value></attr>
<attr name="homePhone"><value>0000000000</value></attr>
<attr name="telephoneNumber"><value>0000000000</value></attr>
<attr name="ENTPersonAdresse"><value>XXXXXXXXXX XXXXXXXXXX XXXXXXXXXX XXXXXXXXXX</value></attr>
<attr name="ENTPersonCodePostal"><value>13090</value></attr>
<attr name="ENTPersonVille"><value>AIX EN PROVENCE</value></attr>
<attr name="ENTPersonPays"><value>FRANCE</value></attr>
</attributes>
</addRequest>
<addRequest>
<operationalAttributes><attr name="categoriePersonne"><value>PersRelEleve</value></attr></operationalAttributes>
<identifier><id>2005363</id></identifier>
<attributes>
<attr name="ENTPersonJointure"><value>2005363</value></attr>
<attr name="ENTPersonDateNaissance"><value/></attr>
<attr name="ENTPersonNomPatro"><value>GBEPBYAJ</value></attr>
<attr name="sn"><value>Butler</value></attr>
<attr name="givenName"><value>Réjane</value></attr>
<attr name="personalTitle"><value>M.</value></attr>
<attr name="homePhone"><value>0000000000</value></attr>
<attr name="telephoneNumber"><value>0000000000</value></attr>
<attr name="ENTPersonAdresse"><value>XXXXXXXXXX XXXXXXXXXX XXXXXXXXXX XXXXXXXXXX</value></attr>
<attr name="ENTPersonCodePostal"><value>13110</value></attr>
<attr name="ENTPersonVille"><value>PORT DE BOUC</value></attr>
<attr name="ENTPersonPays"><value>FRANCE</value></attr>
</attributes>
</addRequest>
<addRequest>
<operationalAttributes><attr name="categoriePersonne"><value>PersRelEleve</value></attr></operationalAttributes>
<identifier><id>2005364</id></identifier>
<attributes>
<attr name="ENTPersonJointure"><value>2005364</value></attr>
<attr name="ENTPersonDateNaissance"><value/></attr>
<attr name="ENTPersonNomPatro"><value>SQADKAEF</value></attr>
<attr name="sn"><value>Butler</value></attr>
<attr name="givenName"><value>Stévina</value></attr>
<attr name="personalTitle"><value>Mme</value></attr>
<attr name="homePhone"><value>0000000000</value></attr>
<attr name="telephoneNumber"><value>0000000000</value></attr>
<attr name="ENTPersonAdresse"><value>XXXXXXXXXX XXXXXXXXXX XXXXXXXXXX XXXXXXXXXX</value></attr>
<attr name="ENTPersonCodePostal"><value>13110</value></attr>
<attr name="ENTPersonVille"><value>PORT DE BOUC</value></attr>
<attr name="ENTPersonPays"><value>FRANCE</value></attr>
</attributes>
</addRequest>
<addRequest>
<operationalAttributes><attr name="categoriePersonne"><value>PersRelEleve</value></attr></operationalAttributes>
<identifier><id>2008374</id></identifier>
<attributes>
<attr name="ENTPersonJointure"><value>2008374</value></attr>
<attr name="ENTPersonDateNaissance"><value/></attr>
<attr name="ENTPersonNomPatro"><value>LEMPUPSCY</value></attr>
<attr name="sn"><value>Greene</value></attr>
<attr name="givenName"><value>Bérénice</value></attr>
<attr name="personalTitle"><value>Mme</value></attr>
<attr name="homePhone"><value>0000000000</value></attr>
<attr name="telephoneNumber"><value>0000000000</value></attr>
<attr name="ENTPersonAdresse"><value>XXXXXXXXXX XXXXXXXXXX XXXXXXXXXX XXXXXXXXXX</value></attr>
<attr name="ENTPersonCodePostal"><value>05200</value></attr>
<attr name="ENTPersonVille"><value>EMBRUN</value></attr>
<attr name="ENTPersonPays"><value>FRANCE</value></attr>
</attributes>
</addRequest>
<addRequest>
<operationalAttributes><attr name="categoriePersonne"><value>PersRelEleve</value></attr></operationalAttributes>
<identifier><id>2008375</id></identifier>
<attributes>
<attr name="ENTPersonJointure"><value>2008375</value></attr>
<attr name="ENTPersonDateNaissance"><value/></attr>
<attr name="ENTPersonNomPatro"><value>TIRHEY</value></attr>
<attr name="sn"><value>Greene</value></attr>
<attr name="givenName"><value>Danièle</value></attr>
<attr name="personalTitle"><value>M.</value></attr>
<attr name="homePhone"><value>0000000000</value></attr>
<attr name="telephoneNumber"><value>0000000000</value></attr>
<attr name="ENTPersonAdresse"><value>XXXXXXXXXX XXXXXXXXXX XXXXXXXXXX XXXXXXXXXX</value></attr>
<attr name="ENTPersonCodePostal"><value>05200</value></attr>
<attr name="ENTPersonVille"><value>EMBRUN</value></attr>
<attr name="ENTPersonPays"><value>FRANCE</value></attr>
</attributes>
</addRequest>
</ficAlimMENESR>
