<!DOCTYPE ficAlimMENESR SYSTEM "ficAlimMENESR.dtd">
<ficAlimMENESR>
<!-- versionAF="AAF-VE1301" -->
<addRequest>
<operationalAttributes><attr name="categoriePersonne"><value>PersRelEleve</value></attr></operationalAttributes>
<identifier><id>2264943</id></identifier>
<attributes>
<attr name="ENTPersonJointure"><value>2264943</value></attr>
<attr name="ENTPersonDateNaissance"><value/></attr>
<attr name="ENTPersonNomPatro"><value>VOJOMH</value></attr>
<attr name="sn"><value>Austin</value></attr>
<attr name="givenName"><value>Ma√©na</value></attr>
<attr name="personalTitle"><value>Mme</value></attr>
<attr name="homePhone"><value>0000000000</value></attr>
<attr name="telephoneNumber"><value>0000000000</value></attr>
<attr name="ENTPersonAdresse"><value>XXXXXXXXXX XXXXXXXXXX XXXXXXXXXX XXXXXXXXXX</value></attr>
<attr name="ENTPersonCodePostal"><value>05600</value></attr>
<attr name="ENTPersonVille"><value>GUILLESTRE</value></attr>
<attr name="ENTPersonPays"><value>FRANCE</value></attr>
</attributes>
</addRequest>
</ficAlimMENESR>
