<!DOCTYPE ficAlimMENESR SYSTEM "ficAlimMENESR.dtd">
<ficAlimMENESR>
<!-- versionAF="AAF-VE1301" -->
<addRequest>
<operationalAttributes><attr name="categoriePersonne"><value>PersRelEleve</value></attr></operationalAttributes>
<identifier><id>2049716</id></identifier>
<attributes>
<attr name="ENTPersonJointure"><value>2049716</value></attr>
<attr name="ENTPersonDateNaissance"><value/></attr>
<attr name="ENTPersonNomPatro"><value>PATHAY</value></attr>
<attr name="sn"><value>Wells</value></attr>
<attr name="givenName"><value>Desirée</value></attr>
<attr name="personalTitle"><value/></attr>
<attr name="homePhone"><value>0000000000</value></attr>
<attr name="telephoneNumber"><value>0000000000</value></attr>
<attr name="ENTPersonAdresse"><value>XXXXXXXXXX XXXXXXXXXX XXXXXXXXXX XXXXXXXXXX</value></attr>
<attr name="ENTPersonCodePostal"><value>13100</value></attr>
<attr name="ENTPersonVille"><value>AIX EN PROVENCE</value></attr>
<attr name="ENTPersonPays"><value>FRANCE</value></attr>
</attributes>
</addRequest>
<addRequest>
<operationalAttributes><attr name="categoriePersonne"><value>PersRelEleve</value></attr></operationalAttributes>
<identifier><id>2049880</id></identifier>
<attributes>
<attr name="ENTPersonJointure"><value>2049880</value></attr>
<attr name="ENTPersonDateNaissance"><value/></attr>
<attr name="ENTPersonNomPatro"><value>FONDEE</value></attr>
<attr name="sn"><value>Wells</value></attr>
<attr name="givenName"><value>Mélinda</value></attr>
<attr name="personalTitle"><value/></attr>
<attr name="homePhone"><value>0000000000</value></attr>
<attr name="telephoneNumber"><value>0000000000</value></attr>
<attr name="ENTPersonAdresse"><value>XXXXXXXXXX XXXXXXXXXX XXXXXXXXXX XXXXXXXXXX</value></attr>
<attr name="ENTPersonCodePostal"><value>13100</value></attr>
<attr name="ENTPersonVille"><value>AIX EN PROVENCE</value></attr>
<attr name="ENTPersonPays"><value>FRANCE</value></attr>
</attributes>
</addRequest>
</ficAlimMENESR>
