<!DOCTYPE ficAlimMENESR SYSTEM "ficAlimMENESR.dtd">
<ficAlimMENESR>
<!-- versionAF="AAF-VE1301" -->
<addRequest>
<operationalAttributes><attr name="categoriePersonne"><value>PersRelEleve</value></attr></operationalAttributes>
<identifier><id>2064768</id></identifier>
<attributes>
<attr name="ENTPersonJointure"><value>2064768</value></attr>
<attr name="ENTPersonDateNaissance"><value/></attr>
<attr name="ENTPersonNomPatro"><value>CIVIH</value></attr>
<attr name="sn"><value>Peters</value></attr>
<attr name="givenName"><value>Faîtes</value></attr>
<attr name="personalTitle"><value/></attr>
<attr name="homePhone"><value>0000000000</value></attr>
<attr name="telephoneNumber"><value>0000000000</value></attr>
<attr name="ENTPersonAdresse"><value>XXXXXXXXXX XXXXXXXXXX XXXXXXXXXX XXXXXXXXXX</value></attr>
<attr name="ENTPersonCodePostal"><value>04160</value></attr>
<attr name="ENTPersonVille"><value>CHATEAU ARNOUX ST AUBAN</value></attr>
<attr name="ENTPersonPays"><value>FRANCE</value></attr>
</attributes>
</addRequest>
<addRequest>
<operationalAttributes><attr name="categoriePersonne"><value>PersRelEleve</value></attr></operationalAttributes>
<identifier><id>2064770</id></identifier>
<attributes>
<attr name="ENTPersonJointure"><value>2064770</value></attr>
<attr name="ENTPersonDateNaissance"><value/></attr>
<attr name="ENTPersonNomPatro"><value>CADZAXPEYTI</value></attr>
<attr name="sn"><value>Peters</value></attr>
<attr name="givenName"><value>Sélène</value></attr>
<attr name="personalTitle"><value/></attr>
<attr name="homePhone"><value>0000000000</value></attr>
<attr name="telephoneNumber"><value>0000000000</value></attr>
<attr name="ENTPersonAdresse"><value>XXXXXXXXXX XXXXXXXXXX XXXXXXXXXX XXXXXXXXXX</value></attr>
<attr name="ENTPersonCodePostal"><value>05290</value></attr>
<attr name="ENTPersonVille"><value>VALLOUISE</value></attr>
<attr name="ENTPersonPays"><value>FRANCE</value></attr>
</attributes>
</addRequest>
<addRequest>
<operationalAttributes><attr name="categoriePersonne"><value>PersRelEleve</value></attr></operationalAttributes>
<identifier><id>2068560</id></identifier>
<attributes>
<attr name="ENTPersonJointure"><value>2068560</value></attr>
<attr name="ENTPersonDateNaissance"><value/></attr>
<attr name="ENTPersonNomPatro"><value>CEZZQIDW</value></attr>
<attr name="sn"><value>Palmer</value></attr>
<attr name="givenName"><value>Daphnée</value></attr>
<attr name="personalTitle"><value>Mme</value></attr>
<attr name="homePhone"><value>0000000000</value></attr>
<attr name="telephoneNumber"><value>0000000000</value></attr>
<attr name="ENTPersonAdresse"><value>XXXXXXXXXX XXXXXXXXXX XXXXXXXXXX XXXXXXXXXX</value></attr>
<attr name="ENTPersonCodePostal"><value>13001</value></attr>
<attr name="ENTPersonVille"><value>MARSEILLE</value></attr>
<attr name="ENTPersonPays"><value>FRANCE</value></attr>
</attributes>
</addRequest>
<addRequest>
<operationalAttributes><attr name="categoriePersonne"><value>PersRelEleve</value></attr></operationalAttributes>
<identifier><id>2068561</id></identifier>
<attributes>
<attr name="ENTPersonJointure"><value>2068561</value></attr>
<attr name="ENTPersonDateNaissance"><value/></attr>
<attr name="ENTPersonNomPatro"><value>WIEBUPIE</value></attr>
<attr name="sn"><value>Palmer</value></attr>
<attr name="givenName"><value>Méng</value></attr>
<attr name="personalTitle"><value>M.</value></attr>
<attr name="homePhone"><value>0000000000</value></attr>
<attr name="telephoneNumber"><value>0000000000</value></attr>
<attr name="ENTPersonAdresse"><value>XXXXXXXXXX XXXXXXXXXX XXXXXXXXXX XXXXXXXXXX</value></attr>
<attr name="ENTPersonCodePostal"><value>13001</value></attr>
<attr name="ENTPersonVille"><value>MARSEILLE</value></attr>
<attr name="ENTPersonPays"><value>FRANCE</value></attr>
</attributes>
</addRequest>
<addRequest>
<operationalAttributes><attr name="categoriePersonne"><value>PersRelEleve</value></attr></operationalAttributes>
<identifier><id>2069682</id></identifier>
<attributes>
<attr name="ENTPersonJointure"><value>2069682</value></attr>
<attr name="ENTPersonDateNaissance"><value/></attr>
<attr name="ENTPersonNomPatro"><value>VYVSAUX</value></attr>
<attr name="sn"><value>Moore</value></attr>
<attr name="givenName"><value>Camélia</value></attr>
<attr name="personalTitle"><value>Mme</value></attr>
<attr name="homePhone"><value>0000000000</value></attr>
<attr name="telephoneNumber"><value>0000000000</value></attr>
<attr name="ENTPersonAdresse"><value>XXXXXXXXXX XXXXXXXXXX XXXXXXXXXX XXXXXXXXXX</value></attr>
<attr name="ENTPersonCodePostal"><value>13200</value></attr>
<attr name="ENTPersonVille"><value>ARLES</value></attr>
<attr name="ENTPersonPays"><value>FRANCE</value></attr>
</attributes>
</addRequest>
<addRequest>
<operationalAttributes><attr name="categoriePersonne"><value>PersRelEleve</value></attr></operationalAttributes>
<identifier><id>2069689</id></identifier>
<attributes>
<attr name="ENTPersonJointure"><value>2069689</value></attr>
<attr name="ENTPersonDateNaissance"><value/></attr>
<attr name="ENTPersonNomPatro"><value>PETBAFO</value></attr>
<attr name="sn"><value>Moore</value></attr>
<attr name="givenName"><value>Yénora</value></attr>
<attr name="personalTitle"><value>M.</value></attr>
<attr name="homePhone"><value>0000000000</value></attr>
<attr name="telephoneNumber"><value>0000000000</value></attr>
<attr name="ENTPersonAdresse"><value>XXXXXXXXXX XXXXXXXXXX XXXXXXXXXX XXXXXXXXXX</value></attr>
<attr name="ENTPersonCodePostal"><value>13660</value></attr>
<attr name="ENTPersonVille"><value>ORGON</value></attr>
<attr name="ENTPersonPays"><value>FRANCE</value></attr>
</attributes>
</addRequest>
<addRequest>
<operationalAttributes><attr name="categoriePersonne"><value>PersRelEleve</value></attr></operationalAttributes>
<identifier><id>2080722</id></identifier>
<attributes>
<attr name="ENTPersonJointure"><value>2080722</value></attr>
<attr name="ENTPersonDateNaissance"><value/></attr>
<attr name="ENTPersonNomPatro"><value>SUAMCAUUU</value></attr>
<attr name="sn"><value>Gibson</value></attr>
<attr name="givenName"><value>Styrbjörn</value></attr>
<attr name="personalTitle"><value>M.</value></attr>
<attr name="homePhone"><value>0000000000</value></attr>
<attr name="telephoneNumber"><value>0000000000</value></attr>
<attr name="ENTPersonAdresse"><value>XXXXXXXXXX XXXXXXXXXX XXXXXXXXXX XXXXXXXXXX</value></attr>
<attr name="ENTPersonCodePostal"><value>84300</value></attr>
<attr name="ENTPersonVille"><value>CAVAILLON</value></attr>
<attr name="ENTPersonPays"><value>FRANCE</value></attr>
</attributes>
</addRequest>
</ficAlimMENESR>
